{"operation":"create","operation_id":"campaign-aaaaaaaaaaaaaaaaaaaaaaaaaaaaaaaaaaaaaaaaaaaaaaaaaaaaaaaaaaaaaaaa","campaign_id":"table","version":1,"status":"active","campaign":{"name":"Table","ruleset":"5e","description":"","current_scene":"","house_rules":{}},"characters":[],"session_recaps":[],"scene_director":{"active_npc_ids":[],"next_speaker_index":0,"active_speaker_id":"","active_turn_id":"","lease_expires_unix_ms":0}}
