{"operation":"add_character","operation_id":"campaign-aaaaaaaaaaaaaaaaaaaaaaaaaaaaaaaaaaaaaaaaaaaaaaaaaaaaaaaaaaaaaaaa","campaign_id":"table","version":2,"status":"active","campaign":{"name":"Table","ruleset":"5e","description":"","current_scene":"","house_rules":{}},"characters":[{"id":"pc","name":"Aria","kind":"player","player_user_id":"user","species":"","class":"","level":0,"armor_class":0,"max_hp":10,"ability_scores":{"strength":10,"dexterity":10,"constitution":10,"intelligence":10,"wisdom":10,"charisma":10},"sheet_refs":{},"persona":"","allowed_knowledge_scopes":[],"voice_id":"","speaking_style":"","pronunciation":"","safety_rules":[]}],"scene_director":{"active_npc_ids":[],"next_speaker_index":0,"active_speaker_id":"","active_turn_id":"","lease_expires_unix_ms":0},"session_recaps":[]}
